{
  "meta": {
    "dataset": "simulator-levers",
    "schema": "schemas/simulator-levers.schema.json",
    "as_of": "2026-10-25",
    "version": "1.0.0",
    "description": "Levers of the 'Balance the budget yourself' simulator (file 20 §5.3 after the 15-18 sync), multiplier classes (file 17 §8), toggles and anti-double-counting rules. Sign: positive = improves the balance.",
    "conventions": "Decimal points and no thousands separators in JSON numbers; French formatting (comma decimal, narrow no-break space) is applied at render time. EUR bn = billions of euros, current prices. Every share says % of GDP or % of total public expenditure."
  },
  "sign_convention": "Positive EUR bn = improves the public balance; negative = worsens it.",
  "menu_groups": [
    {
      "id": "taxing_the_very_wealthy",
      "label_en": "Taxing the very wealthy",
      "label_fr": "Taxer les plus fortunés",
      "side": "revenue",
      "mirrors": "popular_targets"
    },
    {
      "id": "broad_revenue",
      "label_en": "Broad taxes and tax expenditures",
      "label_fr": "Impôts larges et niches fiscales",
      "side": "revenue",
      "mirrors": null
    },
    {
      "id": "revenue_claims",
      "label_en": "Party revenue claims (not independently costed)",
      "label_fr": "Recettes annoncées par les partis (non chiffrées de façon indépendante)",
      "side": "revenue",
      "mirrors": null
    },
    {
      "id": "core_spending",
      "label_en": "Pensions, health, civil service, benefits",
      "label_fr": "Retraites, santé, fonction publique, prestations",
      "side": "spending",
      "mirrors": null
    },
    {
      "id": "price_and_wage_measures",
      "label_en": "Price freezes, energy VAT, minimum wage",
      "label_fr": "Gels de prix, TVA énergie, SMIC",
      "side": "spending",
      "mirrors": null
    },
    {
      "id": "spending_claims",
      "label_en": "Party savings claims (not independently costed)",
      "label_fr": "Économies annoncées par les partis (non chiffrées de façon indépendante)",
      "side": "spending",
      "mirrors": null
    },
    {
      "id": "popular_targets",
      "label_en": "Popular targets",
      "label_fr": "Cibles souvent citées",
      "side": "spending",
      "mirrors": "taxing_the_very_wealthy"
    },
    {
      "id": "growth_and_risk",
      "label_en": "Growth and structural levers, risk scenarios (2032 tab)",
      "label_fr": "Leviers de croissance et structurels, scénarios de risque (onglet 2032)",
      "side": "structural",
      "mirrors": null
    }
  ],
  "multiplier_classes": [
    {
      "id": "operating_spending_wages",
      "label_en": "Operating spending and public wage bill",
      "label_fr": "Dépenses de fonctionnement et masse salariale publique",
      "y1": {
        "default": 0.8,
        "low": 0.5,
        "high": 1.1
      },
      "y3_5": {
        "default": 0.7,
        "low": 0.4,
        "high": 1.0
      },
      "kind": "demand",
      "basis": "Mésange; OFCE PB 154; ESCB; BdF; GLP (low end)",
      "flag": null,
      "source_ids": [
        "f17",
        "f17:S6",
        "f17:S8"
      ]
    },
    {
      "id": "public_investment",
      "label_en": "Public investment",
      "label_fr": "Investissement public",
      "y1": {
        "default": 1.0,
        "low": 0.6,
        "high": 1.4
      },
      "y3_5": {
        "default": 0.9,
        "low": 0.5,
        "high": 1.3
      },
      "kind": "demand",
      "basis": "Mésange; Gechert; Cour (long-run potential-growth warning)",
      "flag": null,
      "source_ids": [
        "f17",
        "f17:S6"
      ]
    },
    {
      "id": "health_in_kind",
      "label_en": "Health and other transfers in kind",
      "label_fr": "Santé et autres transferts en nature",
      "y1": {
        "default": 0.8,
        "low": 0.5,
        "high": 1.0
      },
      "y3_5": {
        "default": 0.7,
        "low": 0.4,
        "high": 0.9
      },
      "kind": "demand",
      "basis": "e-mod.fr; OFCE social-security savings 0.69",
      "flag": null,
      "source_ids": [
        "f17",
        "f17:S9"
      ]
    },
    {
      "id": "cash_benefits_working_age",
      "label_en": "Cash social benefits (working-age, means-tested)",
      "label_fr": "Prestations sociales en espèces (âge actif, sous condition de ressources)",
      "y1": {
        "default": 0.5,
        "low": 0.3,
        "high": 1.0
      },
      "y3_5": {
        "default": 0.7,
        "low": 0.4,
        "high": 0.9
      },
      "kind": "demand",
      "basis": "Mésange CSG/IR proxy; OFCE prime d'activité ≈ 1",
      "flag": null,
      "source_ids": [
        "f17"
      ]
    },
    {
      "id": "pension_indexation",
      "label_en": "Pension under-indexation or freeze",
      "label_fr": "Sous-indexation ou gel des pensions",
      "y1": {
        "default": 0.3,
        "low": 0.2,
        "high": 0.5
      },
      "y3_5": {
        "default": 0.6,
        "low": 0.3,
        "high": 0.8
      },
      "kind": "demand",
      "basis": "e-mod.fr; Cour 2026",
      "flag": null,
      "source_ids": [
        "f17",
        "f17:S9"
      ]
    },
    {
      "id": "vat",
      "label_en": "VAT",
      "label_fr": "TVA",
      "y1": {
        "default": 0.3,
        "low": 0.1,
        "high": 0.5
      },
      "y3_5": {
        "default": 0.5,
        "low": 0.1,
        "high": 0.8
      },
      "kind": "demand",
      "basis": "Mésange vs e-mod.fr vs ESCB (largest model disagreement)",
      "flag": "Show the model's own balance gain as an alternative (file 17 §8).",
      "source_ids": [
        "f17"
      ]
    },
    {
      "id": "income_tax_csg",
      "label_en": "Income tax or CSG",
      "label_fr": "Impôt sur le revenu ou CSG",
      "y1": {
        "default": 0.4,
        "low": 0.1,
        "high": 0.5
      },
      "y3_5": {
        "default": 0.8,
        "low": 0.4,
        "high": 0.9
      },
      "kind": "demand",
      "basis": "Mésange; e-mod.fr; ESCB",
      "flag": null,
      "source_ids": [
        "f17"
      ]
    },
    {
      "id": "employer_contributions",
      "label_en": "Employer contributions or production taxes",
      "label_fr": "Cotisations employeurs ou impôts de production",
      "y1": {
        "default": 0.3,
        "low": 0.2,
        "high": 0.4
      },
      "y3_5": {
        "default": 0.7,
        "low": 0.6,
        "high": 1.0
      },
      "kind": "demand",
      "basis": "Mésange; e-mod.fr (rising in the long run)",
      "flag": "Rule and model diverge (Mésange: rule 0.89 vs model 0.72); show the model's balance gain.",
      "source_ids": [
        "f17"
      ]
    },
    {
      "id": "corporate_capital",
      "label_en": "Corporate surtax, taxes on capital income (and high incomes)",
      "label_fr": "Surtaxe d'IS, impôts sur les revenus du capital (et hauts revenus)",
      "y1": {
        "default": 0.3,
        "low": 0.1,
        "high": 0.4
      },
      "y3_5": {
        "default": 0.4,
        "low": 0.2,
        "high": 0.8
      },
      "kind": "demand",
      "basis": "OFCE PB 154 (large-firm surtax 0.29, CDHR ≈ 0); ESCB",
      "flag": "Long-run warning for permanent capital-tax rises.",
      "source_ids": [
        "f17",
        "f17:S8"
      ]
    },
    {
      "id": "wealth_tax",
      "label_en": "Wealth tax on very large fortunes",
      "label_fr": "Impôt sur les très grandes fortunes",
      "y1": {
        "default": 0.1,
        "low": 0.0,
        "high": 0.3
      },
      "y3_5": {
        "default": 0.2,
        "low": 0.0,
        "high": 0.5
      },
      "kind": "demand",
      "basis": "Expert proxy (OFCE CDHR ≈ 0; ESCB capital tax): no direct French estimate",
      "flag": "Expert proxy, labeled as such; revenue uncertainty dominates.",
      "source_ids": [
        "f17"
      ]
    },
    {
      "id": "pension_age_supply",
      "label_en": "Pension age (supply measure)",
      "label_fr": "Âge de la retraite (mesure d'offre)",
      "y1": {
        "default": 0.0,
        "low": -0.1,
        "high": 0.1
      },
      "y3_5": null,
      "kind": "supply",
      "basis": "Cour des comptes Feb 2025 model comparison: GDP +0.3% at 10 years (-0.1% to +1.1%); balance gain +0.4 pt for 2 years (+0.1 to +0.9)",
      "flag": "Applied to pension-system figures only; 'all public finances' figures of file 03 already include induced effects.",
      "source_ids": [
        "f17"
      ],
      "long_run": {
        "gdp_effect_pct_at_10y": {
          "default": 0.3,
          "low": -0.1,
          "high": 1.1
        },
        "balance_gain_pts_gdp_2y": {
          "default": 0.4,
          "low": 0.1,
          "high": 0.9
        }
      }
    },
    {
      "id": "eu_contribution_dev_aid",
      "label_en": "EU contribution; development aid",
      "label_fr": "Contribution à l'UE ; aide au développement",
      "y1": {
        "default": 0.0,
        "low": 0.0,
        "high": 0.2
      },
      "y3_5": {
        "default": 0.0,
        "low": 0.0,
        "high": 0.0
      },
      "kind": "demand",
      "basis": "OFCE PB 154: 'zero or very low'",
      "flag": null,
      "source_ids": [
        "f17",
        "f17:S8"
      ]
    },
    {
      "id": "annee_blanche_composite",
      "label_en": "Année blanche composite (income tax 0.4 / pension indexation 0.3 / cash benefits 0.5)",
      "label_fr": "Composite année blanche (IR 0,4 / indexation des pensions 0,3 / prestations 0,5)",
      "y1": {
        "default": 0.4,
        "low": 0.3,
        "high": 0.5
      },
      "y3_5": {
        "default": 0.7,
        "low": 0.6,
        "high": 0.8
      },
      "kind": "demand",
      "basis": "File 20 §5.3 midpoint of the file 17 components",
      "flag": "Our composite (file 20), flagged.",
      "source_ids": [
        "f20",
        "f17"
      ]
    },
    {
      "id": "firms_taxes_subsidies",